{
  "schemaVersion": 1,
  "revision": 1,
  "show": true,
  "join": {
    "enabled": true,
    "presentation": {
      "text": "&a+ {{ subject.name }} &7entered the garden"
    },
    "variants": []
  },
  "leave": {
    "enabled": true,
    "presentation": {
      "text": "&c- {{ subject.name }} &7left the garden"
    },
    "variants": []
  }
}
